{
  "collected_at": "2026-09-29T00:00:00Z",
  "viewer_login": "archiver",
  "profile": {
    "login": "archiver",
    "name": "Archiver",
    "bio": "I build things",
    "company": null,
    "location": null,
    "blog": "https://example.com",
    "twitter_username": null,
    "email": null,
    "avatar_url": null,
    "html_url": "https://github.com/archiver",
    "public_repos": 3,
    "public_gists": 0,
    "followers": 1,
    "following": 1,
    "created_at": "2025-08-25T00:00:00Z",
    "updated_at": "2026-09-29T00:00:00Z",
    "hireable": null,
    "profile_readme": true,
    "profile_readme_preview": "# Hi"
  },
  "repositories": [
    {
      "private": false,
      "fork": false,
      "archived": true,
      "disabled": false,
      "description": "old",
      "homepage": null,
      "html_url": null,
      "language": "Python",
      "topics": [],
      "license_spdx": null,
      "default_branch": "main",
      "size": 100,
      "stargazers_count": 0,
      "forks_count": 0,
      "open_issues_count": 0,
      "has_issues": true,
      "has_wiki": false,
      "has_pages": false,
      "is_template": false,
      "pushed_at": "2026-09-19T00:00:00Z",
      "created_at": "2026-06-21T00:00:00Z",
      "updated_at": "2026-09-19T00:00:00Z",
      "visibility": "public",
      "parent_full_name": null,
      "has_readme": true,
      "readme_preview": "# Hello",
      "workflow_conclusion": "success",
      "workflow_name": "CI",
      "broken_homepage": null,
      "name": "old1",
      "owner": "archiver",
      "full_name": "archiver/old1"
    },
    {
      "private": false,
      "fork": false,
      "archived": true,
      "disabled": false,
      "description": null,
      "homepage": null,
      "html_url": null,
      "language": "Python",
      "topics": [],
      "license_spdx": null,
      "default_branch": "main",
      "size": 100,
      "stargazers_count": 0,
      "forks_count": 0,
      "open_issues_count": 0,
      "has_issues": true,
      "has_wiki": false,
      "has_pages": false,
      "is_template": false,
      "pushed_at": "2026-09-19T00:00:00Z",
      "created_at": "2026-06-21T00:00:00Z",
      "updated_at": "2026-09-19T00:00:00Z",
      "visibility": "public",
      "parent_full_name": null,
      "has_readme": true,
      "readme_preview": "# Hello",
      "workflow_conclusion": "success",
      "workflow_name": "CI",
      "broken_homepage": null,
      "name": "old2",
      "owner": "archiver",
      "full_name": "archiver/old2"
    },
    {
      "private": false,
      "fork": false,
      "archived": true,
      "disabled": false,
      "description": null,
      "homepage": null,
      "html_url": null,
      "language": "Python",
      "topics": [],
      "license_spdx": null,
      "default_branch": "main",
      "size": 100,
      "stargazers_count": 0,
      "forks_count": 0,
      "open_issues_count": 0,
      "has_issues": true,
      "has_wiki": false,
      "has_pages": false,
      "is_template": false,
      "pushed_at": "2026-09-19T00:00:00Z",
      "created_at": "2026-06-21T00:00:00Z",
      "updated_at": "2026-09-19T00:00:00Z",
      "visibility": "public",
      "parent_full_name": null,
      "has_readme": true,
      "readme_preview": "# Hello",
      "workflow_conclusion": "success",
      "workflow_name": "CI",
      "broken_homepage": null,
      "name": "old3",
      "owner": "archiver",
      "full_name": "archiver/old3"
    },
    {
      "private": false,
      "fork": false,
      "archived": false,
      "disabled": false,
      "description": "still going",
      "homepage": null,
      "html_url": null,
      "language": "Python",
      "topics": [],
      "license_spdx": null,
      "default_branch": "main",
      "size": 100,
      "stargazers_count": 0,
      "forks_count": 0,
      "open_issues_count": 0,
      "has_issues": true,
      "has_wiki": false,
      "has_pages": false,
      "is_template": false,
      "pushed_at": "2026-09-19T00:00:00Z",
      "created_at": "2026-06-21T00:00:00Z",
      "updated_at": "2026-09-19T00:00:00Z",
      "visibility": "public",
      "parent_full_name": null,
      "has_readme": true,
      "readme_preview": "# Hello",
      "workflow_conclusion": "success",
      "workflow_name": "CI",
      "broken_homepage": null,
      "name": "active",
      "owner": "archiver",
      "full_name": "archiver/active"
    }
  ],
  "pull_requests": [],
  "issues": [],
  "workflow_runs": [],
  "activity": [],
  "warnings": [],
  "meta": {}
}
