{
  "collected_at": "2026-09-29T00:00:00Z",
  "viewer_login": "emptyuser",
  "profile": {
    "login": "emptyuser",
    "name": null,
    "bio": null,
    "company": null,
    "location": null,
    "blog": null,
    "twitter_username": null,
    "email": null,
    "avatar_url": null,
    "html_url": "https://github.com/emptyuser",
    "public_repos": 0,
    "public_gists": 0,
    "followers": 1,
    "following": 1,
    "created_at": "2025-08-25T00:00:00Z",
    "updated_at": "2026-09-29T00:00:00Z",
    "hireable": null,
    "profile_readme": false,
    "profile_readme_preview": "# Hi"
  },
  "repositories": [],
  "pull_requests": [],
  "issues": [],
  "workflow_runs": [],
  "activity": [],
  "warnings": [],
  "meta": {}
}
