{
  "collected_at": "2026-09-29T00:00:00Z",
  "viewer_login": "newbie",
  "profile": {
    "login": "newbie",
    "name": null,
    "bio": null,
    "company": null,
    "location": null,
    "blog": null,
    "twitter_username": null,
    "email": null,
    "avatar_url": null,
    "html_url": "https://github.com/newbie",
    "public_repos": 3,
    "public_gists": 0,
    "followers": 1,
    "following": 1,
    "created_at": "2025-08-25T00:00:00Z",
    "updated_at": "2026-09-29T00:00:00Z",
    "hireable": null,
    "profile_readme": false,
    "profile_readme_preview": "# Hi"
  },
  "repositories": [
    {
      "private": false,
      "fork": false,
      "archived": false,
      "disabled": false,
      "description": null,
      "homepage": null,
      "html_url": null,
      "language": "Python",
      "topics": [],
      "license_spdx": null,
      "default_branch": "main",
      "size": 2,
      "stargazers_count": 0,
      "forks_count": 0,
      "open_issues_count": 0,
      "has_issues": true,
      "has_wiki": false,
      "has_pages": false,
      "is_template": false,
      "pushed_at": "2026-09-19T00:00:00Z",
      "created_at": "2026-06-21T00:00:00Z",
      "updated_at": "2026-09-19T00:00:00Z",
      "visibility": "public",
      "parent_full_name": null,
      "has_readme": false,
      "readme_preview": "# Hello",
      "workflow_conclusion": "success",
      "workflow_name": "CI",
      "broken_homepage": null,
      "name": "hello-world",
      "owner": "newbie",
      "full_name": "newbie/hello-world"
    },
    {
      "private": false,
      "fork": false,
      "archived": false,
      "disabled": false,
      "description": "class notes",
      "homepage": null,
      "html_url": null,
      "language": "Python",
      "topics": [
        "notes"
      ],
      "license_spdx": null,
      "default_branch": "main",
      "size": 20,
      "stargazers_count": 0,
      "forks_count": 0,
      "open_issues_count": 0,
      "has_issues": true,
      "has_wiki": false,
      "has_pages": false,
      "is_template": false,
      "pushed_at": "2026-09-19T00:00:00Z",
      "created_at": "2026-06-21T00:00:00Z",
      "updated_at": "2026-09-19T00:00:00Z",
      "visibility": "public",
      "parent_full_name": null,
      "has_readme": true,
      "readme_preview": "# Hello",
      "workflow_conclusion": "success",
      "workflow_name": "CI",
      "broken_homepage": null,
      "name": "notes",
      "owner": "newbie",
      "full_name": "newbie/notes"
    },
    {
      "private": false,
      "fork": false,
      "archived": false,
      "disabled": false,
      "description": null,
      "homepage": null,
      "html_url": null,
      "language": "JavaScript",
      "topics": [],
      "license_spdx": null,
      "default_branch": "main",
      "size": 40,
      "stargazers_count": 0,
      "forks_count": 0,
      "open_issues_count": 0,
      "has_issues": true,
      "has_wiki": false,
      "has_pages": false,
      "is_template": false,
      "pushed_at": "2026-09-19T00:00:00Z",
      "created_at": "2026-06-21T00:00:00Z",
      "updated_at": "2026-09-19T00:00:00Z",
      "visibility": "public",
      "parent_full_name": null,
      "has_readme": true,
      "readme_preview": "# Hello",
      "workflow_conclusion": "success",
      "workflow_name": "CI",
      "broken_homepage": null,
      "name": "todo-app",
      "owner": "newbie",
      "full_name": "newbie/todo-app"
    }
  ],
  "pull_requests": [],
  "issues": [],
  "workflow_runs": [],
  "activity": [],
  "warnings": [],
  "meta": {}
}
